text,title,id,url
"These include flowstones, stalactites, stalagmites, helictites, soda straws, calcite rafts, and columns. These secondary mineral deposits in caves are called ""speleothems"".= Carbonic acid dissolution Limestone dissolves under the action of rainwater and groundwater charged with H2CO3 (carbonic acid) and naturally occurring organic acids. The dissolution process produces a distinctive landform known as ""karst"", characterized by sinkholes and underground drainage. Solutional caves in this landform—topography are often called karst caves.= Sulfuric acid dissolution Lechuguilla Cave in New Mexico and nearby Carlsbad Caverns are now believed to be examples of another type of solutional cave. They were formed by H2S (hydrogen sulfide) gas rising from below, where reservoirs of petroleum give off sulfurous fumes. This gas mixes with ground water and forms H2SO4 (sulfuric acid). The acid then dissolves the limestone from below, rather than from above, by acidic water percolating to the surface. Examples Australia Jenolan Caves, New South Wales= Malaysia List of caves in Malaysia= Taiwan Black Dwarf Cave, Pingtung County= United States Jewel Cave National Monument, South DakotaMammoth Cave National Park, KentuckyRussell Cave National Monument, AlabamaWind Cave National Park, South DakotaOregon Caves National Monument and Preserve, OregonCumberland Caverns, Tennessee= Vietnam Hang Sơn Đoòng, Quảng Bình Province= Germany König-Otto-Tropfsteinhöhle References Sources Gunn, John (2004).",Solutional cave,Q7558985,https://en.wikipedia.org/wiki/Solutional_cave
"The deepest outside Georgia is Lamprechtsofen Vogelschacht Weg Schacht in Austria, which is 1,623 m (5,325 ft) deep. The deepest vertical shaft in a cave is 603 m (1,978 ft) in Vrtoglavica Cave in Slovenia. The second deepest is Ghar-e-Ghala at 562 m (1,844 ft) in the Parau massif near Kermanshah in Iran. The deepest underwater cave bottomed by a remotely operated underwater vehicle at 450 metres (1,480 ft), is the Hranice Abyss in the Czech Republic. The Miao Room is the world's largest known room by volume, with a measured volume of 10,780,000 m3 (381,000,000 cu ft). The largest known room by surface is Sarawak Chamber, in the Gunung Mulu National Park (Miri, Sarawak, Borneo, Malaysia), a sloping, boulder strewn chamber with an area of 154,500 m2 (1,663,000 sq ft). The largest room in a show cave is the Salle de la Verna in the French Pyrenees. The largest passage ever discovered is in the Son Doong Cave in Phong Nha-Kẻ Bàng National Park in Quảng Bình Province, Vietnam.",Cave,Q35509,https://en.wikipedia.org/wiki/Cave
"Caves do form in the dolomite of the Ghaap Plateau, including the Early, Middle and Later Stone Age site of Wonderwerk Cave; however, the caves that form along the escarpment's edge, like that hypothesised for the Taung Child, are formed within a secondary limestone deposit called tufa. There is numerous evidence for other early human species inhabiting caves from at least one million years ago in different parts of the world, including Homo erectus in China at Zhoukoudian, Homo rhodesiensis in South Africa at the Cave of Hearths (Makapansgat), Homo neanderthalensis and Homo heidelbergensis in Europe at Archaeological Site of Atapuerca, Homo floresiensis in Indonesia, and the Denisovans in southern Siberia. In southern Africa, early modern humans regularly used sea caves as shelter starting about 180,000 years ago when they learned to exploit the sea for the first time. The oldest known site is PP13B at Pinnacle Point. This may have allowed rapid expansion of humans out of Africa and colonization of areas of the world such as Australia by 60–50,000 years ago. Throughout southern Africa, Australia, and Europe, early modern humans used caves and rock shelters as sites for rock art, such as those at Giant's Castle. Caves such as the yaodong in China were used for shelter; other caves were used for burials (such as rock-cut tombs), or as religious sites (such as Buddhist caves). Among the known sacred caves are China's Cave of a Thousand Buddhas and the sacred caves of Crete.",Cave,Q35509,https://en.wikipedia.org/wiki/Cave
"These may involve a combination of chemical processes, erosion by water, tectonic forces, microorganisms, pressure, and atmospheric influences. Isotopic dating techniques can be applied to cave sediments, to determine the timescale of the geological events which formed and shaped present-day caves. It is estimated that a cave cannot be more than 3,000 metres (9,800 ft) vertically beneath the surface due to the pressure of overlying rocks. This does not, however, impose a maximum depth for a cave which is measured from its highest entrance to its lowest point, as the amount of rock above the lowest point is dependent on the topography of the landscape above it. For karst caves the maximum depth is determined on the basis of the lower limit of karst forming processes, coinciding with the base of the soluble carbonate rocks. Most caves are formed in limestone by dissolution. Caves can be classified in various other ways as well, including a contrast between active and relict: active caves have water flowing through them; relict caves do not, though water may be retained in them. Types of active caves include inflow caves (""into which a stream sinks""), outflow caves (""from which a stream emerges""), and through caves (""traversed by a stream"").= Solutional Solutional caves or karst caves are the most frequently occurring caves.",Cave,Q35509,https://en.wikipedia.org/wiki/Cave
"Background and early life Merkel was born Angela Dorothea Kasner in 1954, in Hamburg, West Germany, the daughter of Horst Kasner (1926–2011; né Kaźmierczak), a Lutheran pastor and a native of Berlin, and his wife Herlind (1928–2019; née Jentzsch), born in Danzig (now Gdańsk, Poland), a teacher of English and Latin. She has two younger siblings, Marcus Kasner, a physicist, and Irene Kasner, an occupational therapist. In her childhood and youth, Merkel was known among her peers by the nickname ""Kasi"", derived from her last name Kasner. Merkel is of German and Polish descent. Her paternal grandfather, Ludwik Kasner, was a German policeman of Polish ethnicity. After being captured in France during World War I, he joined the Blue Army and likely fought against Germany. He married Merkel's grandmother Margarethe, a German from Berlin, and relocated to her hometown where he again worked in the police. In 1930, they Germanised the Polish name Kaźmierczak to Kasner.",Angela Merkel,Q567,https://en.wikipedia.org/wiki/Angela_Merkel
"Merkel's maternal grandparents were the Danzig politician Willi Jentzsch and Gertrud Alma (née Drange), a daughter of the city clerk of Elbing (now Elbląg, Poland) Emil Drange. Since the mid-1990s, Merkel has publicly mentioned her Polish heritage on several occasions and described herself as a quarter Polish, but her Polish roots became better known as a result of a 2013 biography. Religion played a key role in the Kasner family's migration from West Germany to East Germany. Merkel's paternal grandfather was originally Catholic but the entire family converted to Lutheranism during the childhood of her father, who later studied Lutheran theology in Heidelberg and Hamburg. In 1954, when Angela was just three months old, her father received a pastorate at the church in Quitzow (a district of Perleberg in Brandenburg), which was then in East Germany. The family moved to Templin and Merkel grew up in the countryside 90 km (56 mi) north of East Berlin. In 1968, Merkel joined the Free German Youth (FDJ), the official communist youth movement sponsored by the ruling Marxist–Leninist Socialist Unity Party of Germany. Membership was nominally voluntary, but those who did not join found it difficult to gain admission to higher education.",Angela Merkel,Q567,https://en.wikipedia.org/wiki/Angela_Merkel
"Political commentators have debated the precise extent to which their agendas are similar. Later in her tenure, Merkel acquired the nickname ""Mutti"" (a German familiar form of ""mother""). She has also been called the ""Iron Chancellor"", in reference to Otto von Bismarck. Al Jazeera has criticised the ""Iron Lady"" nickname for Merkel as ""wrong-headed"", noting her pro-European stance, her efforts to combat ""profit-seeking speculators"" during the euro crisis, and her lacking Thatcher's ""my-way-or-the-highway"" attitude towards politics. Personal life In 1977, at the age of 23, Merkel, then Angela Kasner, married physics student Ulrich Merkel (born 1953) and took his surname. The couple divorced in 1982. Her second and current husband is quantum chemist and professor Joachim Sauer, who has largely avoided media attention during and after Merkel's political career. They first met in 1981 and married in 1998.",Angela Merkel,Q567,https://en.wikipedia.org/wiki/Angela_Merkel
"Angela Dorothea Merkel (German: [aŋˈɡeːla doʁoˈteːa ˈmɛʁkl̩] ; née Kasner; born 17 July 1954) is a retired German politician and chemist who served as chancellor of Germany from 2005 to 2021. A member of the Christian Democratic Union (CDU), she previously served as Leader of the Opposition from 2002 to 2005 and as Leader of the Christian Democratic Union from 2000 to 2018. Merkel was the first female chancellor of Germany. During her chancellorship, Merkel was frequently referred to as the de facto leader of the European Union (EU) and the most powerful woman in the world. Beginning in 2016, she was often described as the leader of the free world. Merkel was born in Hamburg in West Germany. Her family moved to East Germany when she was an infant. Merkel obtained a doctorate in quantum chemistry in 1986 and worked as a research scientist until 1989.",Angela Merkel,Q567,https://en.wikipedia.org/wiki/Angela_Merkel
"""Since 2017, Merkel has occasionally been seen shaking visibly on several public occasions, recovering shortly afterwards. After one such occasion, she attributed the shaking to dehydration, saying that she felt better after a drink of water. In September 2021, after evading the question for most of her career, Merkel said that she considered herself a feminist. The statement came in a conference along with Nigerian writer and feminist Chimamanda Ngozi Adichie. Since her retirement, Merkel has commented on the Russian invasion of Ukraine but has otherwise limited her involvement in political matters. She has instead focussed on travelling, attending only ""feel-good events"" (Wohlfühltermine) in a private capacity. Merkel reportedly ""detested"" U. S. President Donald Trump, according to Politico, citing a forthcoming book by Jonathan Karl.= Religion Angela Merkel is a Lutheran member of the Evangelical Church in Berlin, Brandenburg and Silesian Upper Lusatia (German: Evangelische Kirche Berlin-Brandenburg-schlesische Oberlausitz – EKBO), a United Protestant (i.e. both Reformed and Lutheran) church body under the umbrella of the Protestant Church in Germany. The EKBO is a member of the Union of Protestant Churches in the EKD.",Angela Merkel,Q567,https://en.wikipedia.org/wiki/Angela_Merkel
"The total annual budget of Berlin in 2015 exceeded €24.5 ($30.0) billion including a budget surplus of €205 ($240) million. The German Federal city state of Berlin owns extensive assets, including administrative and government buildings, real estate companies, as well as stakes in the Olympic Stadium, swimming pools, housing companies, and numerous public enterprises and subsidiary companies. The federal state of Berlin runs a real estate portal to advertise commercial spaces or land suitable for redevelopment. The Social Democratic Party (SPD) and The Left (Die Linke) took control of the city government after the 2001 state election and won another term in the 2006 state election. From the 2016 state election until the 2023 state election, there was a coalition between the Social Democratic Party, the Greens and the Left Party. Since April 2023, the government has been formed by a coalition between the Christian Democrats and the Social Democrats. The Governing Mayor is simultaneously Lord Mayor of the City of Berlin (Oberbürgermeister der Stadt) and Minister President of the State of Berlin (Ministerpräsident des Bundeslandes). The office of the Governing Mayor is in the Rotes Rathaus (Red City Hall).",Berlin,Q64,https://en.wikipedia.org/wiki/Berlin
"Since 2023, this office has been held by Kai Wegner of the Christian Democrats. He is the first conservative mayor in Berlin in more than two decades.= Boroughs Berlin is subdivided into 12 boroughs or districts (Bezirke). Each borough has several subdistricts or neighborhoods (Ortsteile), which have roots in much older municipalities that predate the formation of Greater Berlin on 1 October 1920. These subdistricts became urbanized and incorporated into the city later on. Many residents strongly identify with their neighborhoods, colloquially called Kiez. At present, Berlin consists of 96 subdistricts, which are commonly made up of several smaller residential areas or quarters. Each borough is governed by a borough council (Bezirksamt) consisting of five councilors (Bezirksstadträte) including the borough's mayor (Bezirksbürgermeister). The council is elected by the borough assembly (Bezirksverordnetenversammlung).",Berlin,Q64,https://en.wikipedia.org/wiki/Berlin
"Nowadays only the mayors of the three city-states (Berlin, Hamburg and Bremen) are still elected by the respective city-state parliaments. In all the other states the mayors are now elected directly by the EU citizens living in that area. The post of mayor may be said to be a professional one, the mayor being the head of the local government, and requiring, in order to be eligible, training in administration. In big cities (details are regulated by state statutes) the official title is Oberbürgermeister (mayor). In these cities, a ""simple"" mayor is just a deputy responsible for a distinct task (e.g., welfare or construction works). Big cities are usually kreisfrei ('district-free'). That means that the city council also has the powers and duties of a rural district council. The leader of a rural district council is called Landrat ('land counsellor').",Mayor,Q30185,https://en.wikipedia.org/wiki/Mayor
"However, the individual boroughs are not independent municipalities, but subordinate to the Senate of Berlin. The borough's mayors make up the council of mayors (Rat der Bürgermeister), which is led by the city's Governing Mayor and advises the Senate. The neighborhoods have no local government bodies.= City partnerships Berlin to this day maintains official partnerships with 17 cities. Town twinning between West Berlin and other cities began with its sister city Los Angeles, California, in 1967. East Berlin's partnerships were canceled at the time of German reunification.= Capital city Berlin is the capital of the Federal Republic of Germany. The President of Germany, whose functions are mainly ceremonial under the German constitution, has their official residence in Bellevue Palace. Berlin is the seat of the German Chancellor (Prime Minister), housed in the Chancellery building, the Bundeskanzleramt. Facing the Chancellery is the Bundestag, the German Parliament, housed in the renovated Reichstag building since the government's relocation to Berlin in 1998.",Berlin,Q64,https://en.wikipedia.org/wiki/Berlin
"During Nazi Germany, the mayor was selected by the NSDAP and the city council was dissolved; it was reconstituted in token form after 1945, but free elections did not take place until after reunification. Today, the city council is the city's central administrative authority. Local elections took place on 26 October 2003 and again in 2008. Between 1990 and 1999, the Chairman of the City Council was known as the ""Town President"" but today the post is the ""Chairman of the City Council"". The mayor is elected directly by the population. The current mayor is Mike Schubert of the Social Democratic Party (SPD) since 2018. The most recent mayoral election was held on 23 September 2018, with a runoff held on 14 October, and the results were as follows:The city council governs the city alongside the mayor. The most recent city council election was held on 26 May 2019, and the results were as follows:= Brandenburg state government The Landtag Brandenburg, the parliament of the state of Brandenburg is in Potsdam.",Potsdam,Q1711,https://en.wikipedia.org/wiki/Potsdam
