text,title,id,url
"Franklin Patrick Herbert Jr. (October 8, 1920 – February 11, 1986) was an American science-fiction author best known for the 1965 novel Dune and its five sequels. Though he became famous for his novels, he also wrote short stories and worked as a newspaper journalist, photographer, book reviewer, ecological consultant, and lecturer. The Dune saga, set in the distant future, and taking place over millennia, explores complex themes, such as the long-term survival of the human species, human evolution, planetary science and ecology, and the intersection of religion, politics, economics, sex, and power in a future where humanity has long since developed interstellar travel and settled many thousands of worlds. Dune is the best-selling science fiction novel of all time, and the series is considered to be among the classics of the science-fiction genre. The series has been adapted numerous times, including the feature film Dune (1984), the miniseries Frank Herbert's Dune and Children of Dune, and a motion picture trilogy currently in production, with Dune (2021) and Dune: Part Two (2024) having recently been released. Biography Early life Frank Patrick Herbert Jr. was born on October 8, 1920, in Tacoma, Washington, to Frank Patrick Herbert Sr.and Eileen (née McCarthy) Herbert. His upbringing included spending a lot of time on the rural Olympic and Kitsap Peninsulas.",Frank Herbert,Q7934,https://en.wikipedia.org/wiki/Frank_Herbert
"His ideas were genuinely developed concepts, not merely decorative notions, but they were sometimes embodied in excessively complicated plots and articulated in prose which did not always match the level of thinking [...] His best novels, however, were the work of a speculative intellect with few rivals in modern science fiction. The Science Fiction Hall of Fame inducted Herbert in 2006. California State University, Fullerton's Pollack Library has several of Herbert's draft manuscripts of Dune and other works, with the author's notes, in their Frank Herbert Archives. Metro Parks Tacoma built Dune Peninsula and the Frank Herbert Trail at Point Defiance Park in July 2019 to honor the hometown writer. Bibliography Posthumously published works Beginning in 2012, Herbert's estate and WordFire Press have released four previously unpublished novels in e-book and paperback formats: High-Opp (2012), Angels' Fall (2013), A Game of Authors (2013), and A Thorn in the Bush (2014). In recent years, Frank Herbert's son Brian Herbert and author Kevin J. Anderson have added to the Dune franchise, using notes left behind by Frank Herbert and discovered over a decade after his death. Brian Herbert and Anderson have written three prequel trilogies (Prelude to Dune, Legends of Dune and Great Schools of Dune) exploring the history of the Dune universe before the events of the original novel, two novels that take place between novels of the original Dune sequels (with plans for more), as well as two post-Chapterhouse Dune novels that complete the original series (Hunters of Dune and Sandworms of Dune) based on Frank Herbert's own Dune 7 outline. References == Sources Touponce, William F. (1988). Frank Herbert. Twayne Publishers.",Frank Herbert,Q7934,https://en.wikipedia.org/wiki/Frank_Herbert
"He delved into both the flaws and potentials of bureaucracy and government. Herbert was among the first science fiction authors to popularize ideas about ecology and systems thinking. He stressed the need for humans to think both holistically and with regards to the long-term. The relationship between religion, politics and power. Human survival and evolution: Herbert writes of the Fremen, the Sardaukar, and the Dosadi, who are molded by their terrible living conditions into dangerous super races. Human possibilities and potential: Herbert offered Mentats, the Bene Gesserit and the Bene Tleilax as different visions of human potential. The nature of sanity and madness. Frank Herbert was interested in the work of Thomas Szasz and the anti-psychiatry movement.",Frank Herbert,Q7934,https://en.wikipedia.org/wiki/Frank_Herbert
"Herbert also opposed American involvement in the war in Vietnam. In Chapterhouse: Dune, he wrote:All governments suffer a recurring problem: Power attracts pathological personalities. It is not that power corrupts but that it is magnetic to the corruptible. Such people have a tendency to become drunk on violence, a condition to which they are quickly addicted. Ideas and themes Frank Herbert used his science fiction novels to explore complex ideas involving philosophy, religion, psychology, politics and ecology. The underlying thrust of his work was a fascination with the question of human survival and evolution. Herbert has attracted a dedicated fan base, many of whom have attempted to read everything he wrote (fiction or non-fiction); indeed, such was the devotion of some of his readers that Herbert was at times asked if he was founding a cult, a proposition which he very much rejected. There are a number of key themes found in Herbert's work:A concern with leadership: Herbert explored the human tendency to slavishly submit itself to charismatic leaders.",Frank Herbert,Q7934,https://en.wikipedia.org/wiki/Frank_Herbert
"Vertex Interviews Frank Herbert"". Volume 1, Issue 4. Archived from the original on May 19, 2009. Retrieved April 16, 2005.1984 interview with L. A. Reader: part 1, 2, 3Frank Herbert on the Literature Map= Biography and criticism Frank Herbert biography at the Encyclopedia of Science FictionArabic and Islamic themes in Frank Herbert's Dune novelsStudy by Tim O'Reilly of Frank Herbert's work up to the Jesus Incident; one of the more in-depth studies of Frank Herbert's thoughts and ideasArticle on the inspirations for Dune""Frank Herbert, the Dune Man"" – (Frederik Pohl)""Frank Herbert, the Dune Man, Part 2""= Bibliography and works Works by Frank Herbert at Project GutenbergWorks by or about Frank Herbert at Internet ArchiveWorks by Frank Herbert at LibriVox (public domain audiobooks) Frank Herbert at the Internet Speculative Fiction DatabaseFrank Herbert at the Internet Book ListFrank Herbert at the Internet Book Database of FictionWorks by Frank Herbert at Open Library",Frank Herbert,Q7934,https://en.wikipedia.org/wiki/Frank_Herbert
"Eventually, the larger capacity of this ground also became insufficient for the ever-increasing crowds attending the games, particularly against high-profile opponents. On several occasions, between the 1920s and 1940s, Porto played host to matches at the Campo do Ameal (Ameal Field) or the Estádio do Lima (Lima Stadium), home of local rivals Sport Progresso and Académico, respectively. It was in the latter ground that the club achieved their most important victory at the time, as they beat English champions Arsenal 3–2 in a friendly match on 7 May 1948. In 1933, Porto approved a plan to build a new stadium to accommodate and meet the demands of larger attendances, but the project only moved forward with the purchase of 48,000 square metres (12 acres) of land in the eastern side of the city in 1947. Designed by Portuguese architects Oldemiro Carneiro and Aires de Sá, the construction of the Estádio do Futebol Clube do Porto – better known as Estádio das Antas (Antas Stadium) for the neighbourhood where it was built – began in January 1950, one month after the first stone was symbolically laid. Two years later, on 28 May 1952, the stadium was inaugurated with a ceremony, featuring the presence of the President of the Republic Francisco Craveiro Lopes, and a match against Benfica, which Porto lost 2–8. The stadium's initial layout had an open east sector (Marathon Door), which was closed in 1976 with the construction of a two-tier stand that raised the capacity to 70,000. In 1986, works to lower the pitch and build an additional tier in the place of the athletics and cycling track were concluded, setting the capacity to a new maximum of 95,000. As stadium safety regulations became stricter during the following decade, the placing of individual seats brought the capacity of the Estádio das Antas down to 55,000 by 1997. The awarding of the UEFA Euro 2004 hosting rights to Portugal in 1999 was the perfect opportunity for Porto to move into a more modern, functional and comfortable stadium, in line with the demands of high-level international football.",FC Porto,Q128446,https://en.wikipedia.org/wiki/FC_Porto
"The club decided to build an entirely new ground and chose a site located a few hundreds of meters southeast of the Estádio das Antas. The project was commissioned to Portuguese architect Manuel Salgado, and construction took two years to complete at a cost of €98 million. Baptised Estádio do Dragão (Dragon Stadium) by president Pinto da Costa, for the mythological creature placed atop the club's crest, it was officially inaugurated on 16 November 2003 with a match against Barcelona. Porto won 2–0 in front of a record 52,000 spectators, which also witnessed the professional debut of Lionel Messi. In June 2004, the venue hosted the opening ceremony and match of the UEFA Euro 2004, and four other tournament matches. The highest attendance in an official match was registered on 21 April 2004, when 50,818 people saw Porto draw Deportivo La Coruña without goals, for the first leg of the 2003–04 UEFA Champions League semi-finals. For safety reasons, its current capacity is limited to 50,431.= Museum On 28 September 2013 The FC Porto Museum was inaugurated, on occasion of the club's 120th anniversary. The museum includes an auditorium, a club store, a coffeehouse, and spaces for educational services and temporary exhibitions.",FC Porto,Q128446,https://en.wikipedia.org/wiki/FC_Porto
"The site was located near the residence of Monteiro da Costa and was the property of the city's horticultural society. Aided by his father, a horticultor by profession, Monteiro da Costa rented a portion (30 by 50 meters) of uncultivated terrain to create the first dedicated football pitch in the country. Later that year, the society's vivaria were transferred to another location, allowing Porto to increase the pitch area to match the sport's official dimensions. The ground had capacity for 600 people, including a VIP tribune, and possessed a changing room equipped with showers and sinks, a bar and a gym. The first match between Porto and a foreign team took place at the Campo da Raínha, on 15 December 1907, when the hosts played Spanish side Real Fortuna. By 1911, the Campo da Raínha was becoming too small for the rapidly growing attendances. After being notified about the sale of the ground for construction of a factory, the club searched for a new ground and rented a terrain near the Constituição street for an annual fee of 350$00. The Campo da Constituição (Constitution Field) was opened in January 1913 with a match against Oporto Cricket and Lawn Tennis Club and hosted Porto's home matches for the regional championship.",FC Porto,Q128446,https://en.wikipedia.org/wiki/FC_Porto
"FC Porto is one of the ""Big Three"" teams in the main Portuguese football league, and was European champion in 1987 and 2004, won the UEFA Cup (2003) and Europa League (2011) and the Intercontinental Toyota Cup in 1987 and 2004. Boavista have won the championship once, in the 2000–01 season and reached the semi-finals of the UEFA Cup in 2003, where they lost 2–1 to Celtic. Formerly, Salgueiros from Paranhos was a regular first division club during the 1980s and 1990s but, due to financial indebtedness, the club folded in the 2000s. The club was refounded in 2008 and began playing at the regional level. They now play at the third level of Portugal's national football pyramid. The biggest stadiums in the city are FC Porto's Estádio do Dragão and Boavista's Estádio do Bessa. The first team in Oporto to own a stadium was Académico, who played in the Estádio do Lima, Académico was one of the eight teams to dispute the first division. Salgueiros, sold the grounds of Estádio Engenheiro Vidal Pinheiro field to the Oporto Metro and planned on building a new field in the Arca d'Água area of Porto.",Porto,Q36433,https://en.wikipedia.org/wiki/Porto
"These sports arenas, swimming pools and sports fields are used for the practice of sports, including varsity and competitive professional sports, in a diversity of sport disciplines ranging from handball, basketball, futsal and field hockey to rink hockey, volleyball, water polo and rugby. Porto is home to northern Portugal's only Cricket club, the Oporto Cricket and Lawn Tennis Club. Annually, for more than 100 years, a match (the Kendall Cup) has been played between the Oporto Club and the Casuals Club of Lisbon, in addition to regular games against touring teams (mainly from England). The club's pitch is located off the Rua Campo Alegre. In 1958 and 1960, Porto's streets hosted the Formula One Portuguese Grand Prix on the Boavista street circuit, which are reenacted annually, in addition to a World Touring Car Championship race. It is one of the potential host cities for the 2030 FIFA World Cup. Every year in October the Oporto Marathon is held through the streets of the old city of Porto.= Football As in most Portuguese cities, football is the most popular sport. There are two main teams in Porto: FC Porto in the parish of Campanhã, in the eastern part of the city and Boavista in the area of Boavista in the parish of Ramalde, in the western part of the city, close to the city centre.",Porto,Q36433,https://en.wikipedia.org/wiki/Porto
"However, three important factors distinguish monarchies such as the United Kingdom from systems where greater power might otherwise rest with Parliament. These are:The royal prerogative, under which the monarch may exercise power under certain very limited circumstancesSovereign immunity, under which the monarch may do no wrong under the law because the responsible government is instead deemed accountableThe immunity of the monarch from some taxation or restrictions on property useOther privileges may be nominal or ceremonial (e.g., where the executive, judiciary, police or armed forces act on the authority of or owe allegiance to the Crown). Today slightly more than a quarter of constitutional monarchies are Western European countries, including the United Kingdom, Spain, the Netherlands, Belgium, Norway, Denmark, Luxembourg, Monaco, Liechtenstein and Sweden. However, the two most populous constitutional monarchies in the world are in Asia: Japan and Thailand. In these countries, the prime minister holds the day-to-day powers of governance, while the monarch retains residual (but not always insignificant) powers. The powers of the monarch differ between countries. In Denmark and in Belgium, for example, the monarch formally appoints a representative to preside over the creation of a coalition government following a parliamentary election, while in Norway the King chairs special meetings of the cabinet. In nearly all cases, the monarch is still the nominal chief executive, but is bound by convention to act on the advice of the Cabinet. Only a few monarchies (most notably Japan and Sweden) have amended their constitutions so that the monarch is no longer even the nominal chief executive.",Constitutional monarchy,Q41614,https://en.wikipedia.org/wiki/Constitutional_monarchy
"With few exceptions, the monarch is bound by constitutional convention to act on the advice of the government.== Continental Europe =Poland developed the first constitution for a monarchy in continental Europe, with the Constitution of 3 May 1791; it was the second single-document constitution in the world just after the first republican Constitution of the United States. Constitutional monarchy also occurred briefly in the early years of the French Revolution, but much more widely afterwards. Napoleon Bonaparte is considered the first monarch proclaiming himself as an embodiment of the nation, rather than as a divinely appointed ruler; this interpretation of monarchy is germane to continental constitutional monarchies. German philosopher Georg Wilhelm Friedrich Hegel, in his work Elements of the Philosophy of Right (1820), gave the concept a philosophical justification that concurred with evolving contemporary political theory and the Protestant Christian view of natural law. Hegel's forecast of a constitutional monarch with very limited powers whose function is to embody the national character and provide constitutional continuity in times of emergency was reflected in the development of constitutional monarchies in Europe and Japan.== Executive monarchy versus ceremonial monarchy =There exist at least two different types of constitutional monarchies in the modern world – executive and ceremonial. In executive monarchies, the monarch wields significant (though not absolute) power. The monarchy under this system of government is a powerful political (and social) institution. By contrast, in ceremonial monarchies, the monarch holds little or no actual power or direct political influence, though they frequently have a great deal of social and cultural influence.",Constitutional monarchy,Q41614,https://en.wikipedia.org/wiki/Constitutional_monarchy
"They fall roughly into the following categories:= Commonwealth realms King Charles III is, separately, monarch of fifteen Commonwealth realms (Antigua and Barbuda, the Commonwealth of Australia, the Commonwealth of the Bahamas, Belize, Canada, Grenada, Jamaica, New Zealand, the Independent State of Papua New Guinea, the Federation of Saint Christopher and Nevis, Saint Lucia, Saint Vincent and the Grenadines, the Solomon Islands, Tuvalu and the United Kingdom of Great Britain and Northern Ireland). They evolved out of the British Empire into fully independent states within the Commonwealth of Nations that retain the King as head of state. All fifteen realms are constitutional monarchies and full democracies where the King has limited powers or a largely ceremonial role. The King is head of the Church of England (the established church of England), while the other 14 realms do not have a state religion.= Other European constitutional monarchies The Principality of Andorra, the Kingdom of Belgium, the Kingdom of Denmark, the Grand Duchy of Luxembourg, the Kingdom of the Netherlands, the Kingdom of Norway, the Kingdom of Spain, and the Kingdom of Sweden are fully democratic states in which the monarch has a limited or largely ceremonial role. Some countries have established a Christian religion as the official church. This is the Lutheran form of Protestantism in Norway, Sweden, and Denmark, while Andorra is a Roman Catholic country. Spain, Belgium, and the Netherlands have no official state religion. Luxembourg, which is predominantly Roman Catholic, has five so-called officially recognized cults of national importance (Roman Catholicism, Protestantism, Greek Orthodoxy, Judaism, and Islam), a status which gives those religions some privileges like the payment of a state salary to their priests.",Monarchy,Q7269,https://en.wikipedia.org/wiki/Monarchy
"Constitutional monarchy, also known as limited monarchy, parliamentary monarchy or democratic monarchy, is a form of monarchy in which the monarch exercises their authority in accordance with a constitution and is not alone in making decisions. Constitutional monarchies differ from absolute monarchies (in which a monarch is the only decision-maker) in that they are bound to exercise powers and authorities within limits prescribed by an established legal framework. Constitutional monarchies range from countries such as Liechtenstein, Monaco, Morocco, Jordan, Kuwait, Bahrain and Bhutan, where the constitution grants substantial discretionary powers to the sovereign, to countries such as the United Kingdom and other Commonwealth realms, the Netherlands, Spain, Belgium, Norway, Sweden, Lesotho, Malaysia, Thailand, Cambodia, and Japan, where the monarch retains significantly less, if any, personal discretion in the exercise of their authority. On the surface level, this distinction may be hard to establish, with numerous liberal democracies restraining monarchic power in practice rather than written law, e.g., the constitution of the United Kingdom, which affords the monarch substantial, if limited, legislative and executive powers. Constitutional monarchy may refer to a system in which the monarch acts as a non-party political head of state under the constitution, whether codified or uncodified. While most monarchs may hold formal authority and the government may legally operate in the monarch's name, in the form typical in Europe the monarch no longer personally sets public policy or chooses political leaders. Political scientist Vernon Bogdanor, paraphrasing Thomas Macaulay, has defined a constitutional monarch as ""A sovereign who reigns but does not rule"". In addition to acting as a visible symbol of national unity, a constitutional monarch may hold formal powers such as dissolving parliament or giving royal assent to legislation.",Constitutional monarchy,Q41614,https://en.wikipedia.org/wiki/Constitutional_monarchy
"Ceremonial and executive monarchy should not be confused with democratic and non-democratic monarchical systems. For example, in Liechtenstein and Monaco, the ruling monarchs wield significant executive power. However, while they are theoretically very powerful within their small states, they are not absolute monarchs and have very limited de facto power compared to the Islamic monarchs, which is why their countries are generally considered to be liberal democracies. For instance, when Hereditary Prince Alois of Liechtenstein threatened to veto a referendum to legalize abortion in 2011, it came as a surprise because the prince had not vetoed any law for over 30 years (in the end, this referendum failed to make it to a vote).= Modern constitutional monarchy As originally conceived, a constitutional monarch was head of the executive branch and quite a powerful figure even though their power was limited by the constitution and the elected parliament. Some of the framers of the U. S. Constitution may have envisioned the president as an elected constitutional monarch, as the term was then understood, following Montesquieu's account of the separation of powers. The present-day concept of a constitutional monarchy developed in the United Kingdom, where the democratically elected parliaments, and their leader, the prime minister, exercise power, with the monarchs having ceded power and remaining as a titular position. In many cases the monarchs, while still at the very top of the political and social hierarchy, were given the status of ""servants of the people"" to reflect the new, egalitarian position. In the course of France's July Monarchy, Louis-Philippe I was styled ""King of the French"" rather than ""King of France"".",Constitutional monarchy,Q41614,https://en.wikipedia.org/wiki/Constitutional_monarchy
"As a result, explored caves are found widely in Europe, Asia, North America and Oceania, but are sparse in South America, Africa, and Antarctica. This is a rough generalization, as large expanses of North America and Asia contain no documented caves, whereas areas such as the Madagascar dry deciduous forests and parts of Brazil contain many documented caves. As the world's expanses of soluble bedrock are researched by cavers, the distribution of documented caves is likely to shift. For example, China, despite containing around half the world's exposed limestone—more than 1,000,000 square kilometres (390,000 sq mi)—has relatively few documented caves. Records and superlatives The cave system with the greatest total length of surveyed passage is Mammoth Cave in Kentucky, US, at 675.9 km (420.0 mi). The longest surveyed underwater cave, and second longest overall, is Sistema Ox Bel Ha in Yucatán, Mexico at 436 km (271 mi). The deepest known cave—measured from its highest entrance to its lowest point—is Veryovkina Cave in Abkhazia, Georgia, with a depth of 2,204 m (7,231 ft). This was the first cave to be explored to a depth of more than 2,000 m (6,600 ft). (The first cave to be descended below 1,000 m (3,300 ft) was Gouffre Berger in France.)The Sarma and Illyuzia-Mezhonnogo-Snezhnaya caves in Georgia, (1,830 m or 6,000 ft, and 1,753 m or 5,751 ft respectively) are the current second- and third-deepest caves.",Cave,Q35509,https://en.wikipedia.org/wiki/Cave
